{
  "kind": "example_value",
  "name": "Example Title",
  "fullPath": "example_value",
  "generation": 10,
  "selfLink": "example_value",
  "abc": "example_value",
  "ackOnPush": "example_value",
  "closeWaitTimeout": 10,
  "congestionControl": "example_value",
  "defaultsFrom": "example_value",
  "deferredAccept": "example_value",
  "description": "A sample description.",
  "finWaitTimeout": 10,
  "idleTimeout": 10,
  "initCwnd": 10,
  "initRwnd": 10,
  "keepAliveInterval": 10,
  "maxRetrans": 10,
  "maxSegmentSize": 10,
  "nagle": "example_value",
  "receiveWindowSize": 10,
  "sendBufferSize": 10,
  "synMaxRetrans": 10,
  "timeWaitRecycle": "example_value",
  "timeWaitTimeout": 10
}